{
  "artifact_type": "model_config_v1",
  "artifact_version": "1.0.0",
  "tenant_id": "t_example001",
  "baseline_id": "bl_mfg001",
  "baseline_version": "v1",
  "created_at": "2026-02-08T10:00:00Z",
  "created_by": "u_analyst01",
  "parent_baseline_id": null,
  "parent_baseline_version": null,
  "template_id": "manufacturing_discrete",

  "metadata": {
    "entity_name": "Crusher Components (Pty) Ltd",
    "entity_description": "Discrete manufacturing of crusher wear parts for mining industry",
    "currency": "ZAR",
    "country_iso": "ZA",
    "start_date": "2026-01-01",
    "horizon_months": 12,
    "resolution": "monthly",
    "fiscal_year_end_month": 12,
    "tax_rate": 0.27,
    "initial_cash": 500000,
    "initial_equity": 2000000
  },

  "assumptions": {
    "revenue_streams": [
      {
        "stream_id": "rs_wear_parts",
        "label": "Crusher Wear Parts",
        "stream_type": "unit_sale",
        "drivers": {
          "volume": [
            {
              "ref": "drv:monthly_capacity",
              "label": "Monthly Production Capacity",
              "value_type": "constant",
              "value": 1000,
              "units": "units",
              "data_type": "integer"
            },
            {
              "ref": "drv:utilization",
              "label": "Plant Utilization Rate",
              "value_type": "ramp",
              "schedule": [
                { "month": 0, "value": 0.6 },
                { "month": 3, "value": 0.7 },
                { "month": 6, "value": 0.75 },
                { "month": 12, "value": 0.85 }
              ],
              "interpolation": "linear",
              "data_type": "percent"
            },
            {
              "ref": "drv:yield_rate",
              "label": "Manufacturing Yield",
              "value_type": "constant",
              "value": 0.92,
              "data_type": "percent"
            }
          ],
          "pricing": [
            {
              "ref": "drv:price_per_unit",
              "label": "Average Selling Price",
              "value_type": "constant",
              "value": 4500,
              "units": "ZAR/unit",
              "data_type": "currency"
            }
          ],
          "direct_costs": [
            {
              "ref": "drv:material_cost",
              "label": "Material Cost Per Unit",
              "value_type": "constant",
              "value": 1800,
              "units": "ZAR/unit",
              "data_type": "currency"
            }
          ]
        },
        "working_capital_profile": {
          "ar_days_ref": "drv:ar_days",
          "ap_days_ref": "drv:ap_days",
          "inv_days_ref": "drv:inv_days"
        }
      }
    ],

    "cost_structure": {
      "variable_costs": [
        {
          "cost_id": "vc_labour",
          "label": "Direct Labour",
          "category": "cogs",
          "driver": {
            "ref": "drv:labour_cost_per_unit",
            "label": "Labour Cost Per Unit",
            "value_type": "constant",
            "value": 600,
            "units": "ZAR/unit",
            "data_type": "currency"
          }
        }
      ],
      "fixed_costs": [
        {
          "cost_id": "fc_plant",
          "label": "Plant Overhead",
          "category": "cogs",
          "driver": {
            "ref": "drv:plant_overhead",
            "label": "Monthly Plant Overhead",
            "value_type": "constant",
            "value": 250000,
            "units": "ZAR/month",
            "data_type": "currency"
          }
        },
        {
          "cost_id": "fc_sga",
          "label": "SG&A",
          "category": "sga",
          "driver": {
            "ref": "drv:sga_monthly",
            "label": "Monthly SG&A",
            "value_type": "constant",
            "value": 180000,
            "units": "ZAR/month",
            "data_type": "currency"
          }
        }
      ],
      "depreciation_method": "straight_line"
    },

    "working_capital": {
      "ar_days": {
        "ref": "drv:ar_days",
        "label": "Accounts Receivable Days",
        "value_type": "constant",
        "value": 45,
        "data_type": "number"
      },
      "ap_days": {
        "ref": "drv:ap_days",
        "label": "Accounts Payable Days",
        "value_type": "constant",
        "value": 30,
        "data_type": "number"
      },
      "inv_days": {
        "ref": "drv:inv_days",
        "label": "Inventory Days",
        "value_type": "constant",
        "value": 60,
        "data_type": "number"
      },
      "minimum_cash": 100000
    },

    "capex": {
      "items": [
        {
          "capex_id": "capex_cnc",
          "label": "CNC Machine Upgrade",
          "amount": 1500000,
          "month": 3,
          "useful_life_months": 60,
          "residual_value": 150000
        }
      ]
    },

    "funding": {
      "equity_raises": [],
      "debt_facilities": [
        {
          "facility_id": "df_revolver",
          "label": "Working Capital Revolver",
          "type": "revolver",
          "limit": 2000000,
          "interest_rate": 0.115,
          "draw_schedule": null,
          "repayment_schedule": null,
          "is_cash_plug": true
        }
      ],
      "dividends": {
        "policy": "none",
        "value": 0
      }
    }
  },

  "driver_blueprint": {
    "nodes": [
      { "node_id": "n_capacity", "type": "driver", "label": "Monthly Capacity", "ref": "drv:monthly_capacity" },
      { "node_id": "n_utilization", "type": "driver", "label": "Utilization", "ref": "drv:utilization" },
      { "node_id": "n_yield", "type": "driver", "label": "Yield Rate", "ref": "drv:yield_rate" },
      { "node_id": "n_price", "type": "driver", "label": "Price Per Unit", "ref": "drv:price_per_unit" },
      { "node_id": "n_material", "type": "driver", "label": "Material Cost", "ref": "drv:material_cost" },
      { "node_id": "n_units_produced", "type": "formula", "label": "Units Produced" },
      { "node_id": "n_revenue", "type": "output", "label": "Revenue" },
      { "node_id": "n_material_cogs", "type": "output", "label": "Material COGS" }
    ],
    "edges": [
      { "from": "n_capacity", "to": "n_units_produced" },
      { "from": "n_utilization", "to": "n_units_produced" },
      { "from": "n_yield", "to": "n_units_produced" },
      { "from": "n_units_produced", "to": "n_revenue" },
      { "from": "n_price", "to": "n_revenue" },
      { "from": "n_units_produced", "to": "n_material_cogs" },
      { "from": "n_material", "to": "n_material_cogs" }
    ],
    "formulas": [
      {
        "formula_id": "f_units",
        "output_node_id": "n_units_produced",
        "expression": "capacity * utilization * yield_rate",
        "inputs": ["n_capacity", "n_utilization", "n_yield"],
        "notes": "Effective monthly production"
      },
      {
        "formula_id": "f_revenue",
        "output_node_id": "n_revenue",
        "expression": "units * price",
        "inputs": ["n_units_produced", "n_price"],
        "notes": "Monthly revenue = units produced × selling price"
      },
      {
        "formula_id": "f_material_cogs",
        "output_node_id": "n_material_cogs",
        "expression": "units * material_cost",
        "inputs": ["n_units_produced", "n_material"],
        "notes": "Material COGS = units produced × material cost per unit"
      }
    ]
  },

  "distributions": [
    {
      "ref": "drv:utilization",
      "family": "triangular",
      "params": { "min": 0.5, "mode": 0.7, "max": 0.9 },
      "notes": "Utilization uncertainty based on order pipeline"
    },
    {
      "ref": "drv:yield_rate",
      "family": "pert",
      "params": { "min": 0.85, "mode": 0.92, "max": 0.97 },
      "notes": "Yield varies with raw material quality"
    },
    {
      "ref": "drv:price_per_unit",
      "family": "normal",
      "params": { "mean": 4500, "std": 300 },
      "notes": "Pricing pressure from competitors"
    }
  ],

  "scenarios": [
    {
      "scenario_id": "sc_downside",
      "label": "Downside: Supply Disruption",
      "description": "Major raw material supplier fails, reducing yield and increasing costs",
      "overrides": [
        { "ref": "drv:yield_rate", "field": "multiplier", "value": 0.85 },
        { "ref": "drv:material_cost", "field": "multiplier", "value": 1.25 }
      ]
    },
    {
      "scenario_id": "sc_upside",
      "label": "Upside: New Mining Contract",
      "description": "Win large volume contract, increasing utilization and volume",
      "overrides": [
        { "ref": "drv:utilization", "field": "multiplier", "value": 1.15 },
        { "ref": "drv:price_per_unit", "field": "multiplier", "value": 0.95 }
      ]
    }
  ],

  "evidence_summary": [
    {
      "assumption_path": "/assumptions/revenue_streams/0/drivers/pricing/0",
      "source": "Management input: CEO confirmed R4,500 avg price based on Q4 2025 actuals",
      "confidence": "high",
      "proposed_by": "user",
      "accepted_by": "u_analyst01",
      "accepted_at": "2026-02-08T09:30:00Z"
    },
    {
      "assumption_path": "/assumptions/revenue_streams/0/drivers/volume/1",
      "source": "Industry benchmark: SA crusher plants typically run 65-85% utilization (MCSA 2025 report)",
      "confidence": "medium",
      "proposed_by": "llm",
      "accepted_by": "u_analyst01",
      "accepted_at": "2026-02-08T09:45:00Z"
    }
  ],

  "integrity": {
    "status": "passed",
    "checks": [
      { "check_id": "IC_SCHEMA_VALID", "severity": "info", "message": "Schema validation passed" },
      { "check_id": "IC_GRAPH_ACYCLIC", "severity": "info", "message": "Driver blueprint is acyclic" },
      { "check_id": "IC_EVIDENCE_COVERAGE", "severity": "warning", "message": "Evidence coverage: 2/8 drivers (25%). Recommend adding evidence for remaining drivers." }
    ]
  }
}
